,Datetime,Tweet Id,Text,Username,Url
0,2022-02-21 10:59:59+00:00,1495714917210595332,@Vapa06 @_tweety_vogel_1 @RogerSaysNo @jannetjejo Nou ik ben er wel een beetje aan toe dus ben benieuwd 😊😅🙏🏻,sundaychildnl,https://twitter.com/sundaychildnl/status/1495714917210595332
1,2022-02-21 10:59:59+00:00,1495714916640112644,"#E313 (A13) Ranst richting Lummen , ter hoogte van Lummen Obstakel op de weg, Linkerrijstrook versperd, 21-02-2022 11:58",t_mobilis_nl,https://twitter.com/t_mobilis_nl/status/1495714916640112644
2,2022-02-21 10:59:59+00:00,1495714916535357440,Nu maar hopen dat het klopt wat @TaxJusticeNL schrijft,Ellen_Timmer,https://twitter.com/Ellen_Timmer/status/1495714916535357440
3,2022-02-21 10:59:58+00:00,1495714912999518211,Vanwege de harde wind komt de mobiele grofvuilinzameling van vanavond helaas te vervallen. De eerstvolgende inzameling is op maandag 7 maart op de Marconiweg. Kijk voor de andere data en locaties op https://t.co/PGjHrzRwrZ. https://t.co/WJQAqTGoB9,OostPactDoor,https://twitter.com/OostPactDoor/status/1495714912999518211
4,2022-02-21 10:59:58+00:00,1495714911867052036,@VergeetMe Hij heeft mijn huishouden nog niet gedaan. Dus ik zeg nog ff niet...,Christi53961470,https://twitter.com/Christi53961470/status/1495714911867052036
5,2022-02-21 10:59:58+00:00,1495714909589590017,"Rijdt Mathieu van der Poel dit jaar klassiekers? ""Hij traint, maar nog niet met het oog op terugkeer""

https://t.co/wEUcwqVJIZ https://t.co/q4BnjwrY9s",sporza_koers,https://twitter.com/sporza_koers/status/1495714909589590017
6,2022-02-21 10:59:57+00:00,1495714905789546496,DPG Media verzweeg ontslag directeur in ‘16 wegens seksueel grensoverschrijdend gedrag. Er mocht niet over dit schandaal gepubliceerd worden. Who’s next? https://t.co/797CZa3b85,JolandevdGraaf,https://twitter.com/JolandevdGraaf/status/1495714905789546496
7,2022-02-21 10:59:56+00:00,1495714904006930432,"Psssst.. we weten toch allemaal dat partijen bewust cultuurverschillen (""oorlog"") gebruiken omdat ze inhoudelijk niet echt iets (nieuws) te brengen hebben en dus alleen aandacht en stemmers krijgen op opgezweepte onderbuik emotie #stemmingmakerij #emotieterreur #beleving",Moonniet,https://twitter.com/Moonniet/status/1495714904006930432
8,2022-02-21 10:59:56+00:00,1495714901473517571,Eel slap! https://t.co/LM9MZrlFCb,omg_rayyan,https://twitter.com/omg_rayyan/status/1495714901473517571
9,2022-02-21 10:59:55+00:00,1495714898566946817,Bevriest mijn bankrekening nu? #Trudeau #TruckersForFreedom2022 #CanadaFreedomConvoy https://t.co/XAr4siKTkK,LarsLootens,https://twitter.com/LarsLootens/status/1495714898566946817
10,2022-02-21 10:59:54+00:00,1495714895102451715,"Dit jaar vieren WIIS-NL en @ISGA_Hague internationale vrouwendag met een live event! Tijdens “Jane Bond: Vrouwen in Intel”, gaat @WillemijnAerdts in gesprek met plaatsvervangend directeur-generaal van de #AIVD, Simone Smit. Meld je nu aan: https://t.co/CIXEvXH7jG #BreakTheBias https://t.co/Lx0repXymu",WIIS_NL,https://twitter.com/WIIS_NL/status/1495714895102451715
11,2022-02-21 10:59:54+00:00,1495714895089831940,"⚠🌳 Door omvergevallen bomen en dringende werken en inspecties, moeten wij uit veiligheidsoverwegingen de Lorrainedreef per direct afsluiten voor het verkeer. Wij doen ons uiterste best om dit ASAP in orde te krijgen! Dank voor uw begrip. https://t.co/iKJuU659Ew",dimitristrobbe,https://twitter.com/dimitristrobbe/status/1495714895089831940
12,2022-02-21 10:59:53+00:00,1495714891856072707,"Morgen bieden we onze petitie tegen killer robots bij de Tweede Kamer aan. Dus teken vandaag nog!

@PAXvoorvrede  roept de regering op zich in te zetten voor een verdrag dat killer robots verbiedt en menselijke controle over autonome wapens garandeert.

https://t.co/1H9m2KEF8T",DaanKayser,https://twitter.com/DaanKayser/status/1495714891856072707
13,2022-02-21 10:59:53+00:00,1495714889293250560,"Astronomen denken dat ze bewijs hebben gevonden voor een extreem krachtige kernexplosie in de ruimte – een explosie die zo zeldzaam is, dat we hem waarschijnlijk nooit meer zullen zien.

https://t.co/2aeDj4j5q7",NewScientistNL,https://twitter.com/NewScientistNL/status/1495714889293250560
14,2022-02-21 10:59:52+00:00,1495714886235607043,Arrestatie vanwege vermoedelijke drugshandel https://t.co/j8Aszp5ePt,haartha,https://twitter.com/haartha/status/1495714886235607043
15,2022-02-21 10:59:52+00:00,1495714885442981895,Weetje van de dag.  Bron: cijfersliegenniet https://t.co/GGDKLEWrUY,BGMproflint,https://twitter.com/BGMproflint/status/1495714885442981895
16,2022-02-21 10:59:51+00:00,1495714882771206152,Kan #tijdvoormax na de herhaling op maandag niet ff die Piet Paulusma er uit snijden ? Alweer zware #storm op komst vandaag ? Of laat dan een mededeling lopen op het scherm dat het oud nieuws is @tijdvoormax,paulake,https://twitter.com/paulake/status/1495714882771206152
17,2022-02-21 10:59:50+00:00,1495714877649960964,bvndit,stayzmomo,https://twitter.com/stayzmomo/status/1495714877649960964
18,2022-02-21 10:59:49+00:00,1495714871824031749,@Vonn681 En schakel je dan steeds van de een naar de andere?,Mensendieck_,https://twitter.com/Mensendieck_/status/1495714871824031749
19,2022-02-21 10:59:48+00:00,1495714868137185281,"Djiezes, wat voor iemand ben je dan?… Ex praeses GBK in de morgen… plots in haar #sorryvoormijnsoort @demorgen https://t.co/Wj6EARIpuz https://t.co/xf67tAZU6e",guidooohh,https://twitter.com/guidooohh/status/1495714868137185281
20,2022-02-21 10:59:48+00:00,1495714867243847680,Nieuwe #vacature BI (business intelligence) Consultant https://t.co/bXs89GxEX3,Collegaegezocht,https://twitter.com/Collegaegezocht/status/1495714867243847680
21,2022-02-21 10:59:47+00:00,1495714866362994688,En met DIE vent staat men enkel op de foto omdat hij GELD heeft. VEEL geld. Mensen doen daar heel veel voor........om maar een graantje mee te kunnen pikken. Ik heb ze meegemaakt mensen. Ik ken dat volk! https://t.co/1FlaJAAjvL,MathildeReali,https://twitter.com/MathildeReali/status/1495714866362994688
22,2022-02-21 10:59:47+00:00,1495714865310310402,"Ook wel toevallig, dat ie nu nét z'n telefoon heeft laten vallen🤣🤣 geloof er geen snars van. https://t.co/3iJNtZQ0R3",Gwoonmartine,https://twitter.com/Gwoonmartine/status/1495714865310310402
23,2022-02-21 10:59:47+00:00,1495714864911859714,De Coronapas: Het paard van Troje! - mr. Jeroen Pols en mr. Hanno Wisse https://t.co/x950Y4EMDO #LBRY via @OdyseeTeam,Rosa49416100,https://twitter.com/Rosa49416100/status/1495714864911859714
24,2022-02-21 10:59:47+00:00,1495714864001855492,"Same mindset 

KYCHIE 4Months StrongERR",KCerr21,https://twitter.com/KCerr21/status/1495714864001855492
25,2022-02-21 10:59:46+00:00,1495714862328131591,Dan is het plaatje in ieder geval compleet.,Jandevries2005,https://twitter.com/Jandevries2005/status/1495714862328131591
26,2022-02-21 10:59:46+00:00,1495714861145276419,Vanavond het reclameblok op onze Nationale omroep weer eens bekeken. Allemaal stikstofmanipulerende FvD-schildmaagden. ALLE VLAGGEN OP Z'N KOP 🇳🇱,RealistBotNL,https://twitter.com/RealistBotNL/status/1495714861145276419
27,2022-02-21 10:59:46+00:00,1495714859459174402,"Komen jullie aanstaande zondag ook gezellig naar de markt die deelnemer Gerard organiseert in @DeWielepet?

Op de markt vind je ook producten van andere deelnemers. Zoals sokken, mutsen &amp; petten. Ook zijn er schilderijen verkrijgbaar en is er een rommelmarkt met leuke spulletjes. https://t.co/7LSVNaPhRj",teamwestland,https://twitter.com/teamwestland/status/1495714859459174402
28,2022-02-21 10:59:46+00:00,1495714859291398150,aaaah mijn specialiteit https://t.co/C9glQAeBEN,chloormanderijn,https://twitter.com/chloormanderijn/status/1495714859291398150
29,2022-02-21 10:59:46+00:00,1495714859111137283,"Het klimaat, we worden ervoor uitgeknepen. Geen stuiver mogen we overhouden om voor iets leuks te kunnen sparen (of voor de noodzakelijke dingen) een illusie die ons beroofd van alles wat we hebben op niets af.",AnneliesdeZeeuw,https://twitter.com/AnneliesdeZeeuw/status/1495714859111137283
30,2022-02-21 10:59:45+00:00,1495714857676640257,heb gedroomd dat ik top surgery kreeg godverdomme mn brain is fucking with me,swaggynemoo,https://twitter.com/swaggynemoo/status/1495714857676640257
31,2022-02-21 10:59:45+00:00,1495714857198444545,Ik heb al 3x vanmorgen tegen Job gezegd dat het zo droog zou zijn vlgs de buienradar en dat we dan even gingen wandelen 🤷‍♀️Het is nog niet gelukt #hondenweer https://t.co/FANTxUDiFa,batamigo,https://twitter.com/batamigo/status/1495714857198444545
32,2022-02-21 10:59:44+00:00,1495714852492427264,"@Vapa06 @neetegenmsm1 @EdRieswijk Waarom wordt er ""gezocht"" naar buitenaards leven of naar andere planeten, terwijl onze eigen oceanen niet eens voor 20% zijn onderzocht?",Rosa0171,https://twitter.com/Rosa0171/status/1495714852492427264
33,2022-02-21 10:59:44+00:00,1495714851993407492,#StormFranklin raast over ons land. De 🌧️ en harde wind zorgen ervoor dat de polders in ons gebied vol water staan. Onze gemalen draaien volop om het water weg te pompen. Om het water in ons gebied op peil te houden hebben we oa gemaal Zeeburg aangezet.ℹ️👇https://t.co/NhnnP1fziV,waterschapagv,https://twitter.com/waterschapagv/status/1495714851993407492
34,2022-02-21 10:59:44+00:00,1495714851724963841,💕Bestie https://t.co/c2c57de9k6,AnarchoMunki,https://twitter.com/AnarchoMunki/status/1495714851724963841
35,2022-02-21 10:59:42+00:00,1495714842161909761,‘Veluwse Voedselbank is helemaal klaar met oplichters’ https://t.co/8rBQbIvDh6,VeluweFm,https://twitter.com/VeluweFm/status/1495714842161909761
36,2022-02-21 10:59:40+00:00,1495714836898062343,Een slap lam bij de geboorte: wat nu? - https://t.co/oylZv2AfcI https://t.co/ThO0F0cIlU,schapendokter,https://twitter.com/schapendokter/status/1495714836898062343
37,2022-02-21 10:59:40+00:00,1495714834100457473,ik ben ni meer mee met economie,banaanilaan,https://twitter.com/banaanilaan/status/1495714834100457473
38,2022-02-21 10:59:38+00:00,1495714825569193988,"Ik heb een zwaar gemoed over die oorlog die nu toch echt gaat beginnen, verschrikkelijk voor de mensen in Oekraïne die straks de bombardementen te verduren krijgen en de Russen die voor Poetin’s waanidee hun leven gaan geven. Maar ik vrees dat het ons ook gaat raken.",CarlKonigel,https://twitter.com/CarlKonigel/status/1495714825569193988
39,2022-02-21 10:59:37+00:00,1495714823220436993,"#Rutte4 jat de fiets vanonder onze konten tijdens het rijden 

en het gros van het volk accepteert het gelaten. 

Waar blijft de collectieve verontwaardiging en waar blijft de opstand? 

#energiearmoede #klimaathysterie #Coronabedrog #QRdictatuur #WEFpuppets #EUterreur",CazadorLimburgo,https://twitter.com/CazadorLimburgo/status/1495714823220436993
40,2022-02-21 10:59:37+00:00,1495714822259888129,will update pagtapos ko maligo hwuwhwhwhwhwhhwhwhahahwhwhahw,lvbwke,https://twitter.com/lvbwke/status/1495714822259888129
41,2022-02-21 10:59:36+00:00,1495714820192186371,#D66 Wel verdienen aan benzine- en energiekosten om dit uit te kunnen geven aan klimaatgekte 60 miljard. Maar wel ouderen en sociaalzwakkeren in de kou laten zitten. #D66 en #Sigridkaag geven niet Nederlandse burgers maar wel miljarden uitgeven aan asielzoekers. Stop de duivel.,Triumpf2,https://twitter.com/Triumpf2/status/1495714820192186371
42,2022-02-21 10:59:36+00:00,1495714820011794439,"Stenen eruit, stekjes erin! #Grasvezel",daanbultje,https://twitter.com/daanbultje/status/1495714820011794439
43,2022-02-21 10:59:36+00:00,1495714818174726148,"Maandag was voor de zesde dag op rij een officiële stormdag, een record voor februari. In de nacht van zondag op maandag was op Vlieland één uur sprake van windkracht 9.  https://t.co/BbOBRTgaQ4",nrc,https://twitter.com/nrc/status/1495714818174726148
44,2022-02-21 10:59:36+00:00,1495714817419665410,"Naar de reacties kijken door anonieme ScienTeslagy aandelenboys op zoveel-honderdste klantenbedrog door Tesla ..

Net alsof je naar reacties van betaalde Kremlintrollen kijkt, op wat er nu gebeurt in Oekraine.

Anoniem. Gaslighting. En meteen erop duiken.

https://t.co/XTv3WUY0R0",ton_aarts,https://twitter.com/ton_aarts/status/1495714817419665410
45,2022-02-21 10:59:35+00:00,1495714815444140036,NAHHHHH ik wilde vragen waarom zij allemaal floor heten maar dat betekent ofc staanplekken bye https://t.co/w1W4BQ5byx,finelinelwtt,https://twitter.com/finelinelwtt/status/1495714815444140036
46,2022-02-21 10:59:35+00:00,1495714814332702726,Le pichet https://t.co/khO1UcO6ko,plante_belle,https://twitter.com/plante_belle/status/1495714814332702726
47,2022-02-21 10:59:35+00:00,1495714813447712773,"Hopen doe je op de wc!

Het gaat om daden ....  toeslagenschandaal, Groningen, energiearmoede, CTB / E-ID, inmenging van WEF  etc etc 

Deze regering behoort af te treden. 

Totaal géén vertrouwen meer.",Peetie_XXX,https://twitter.com/Peetie_XXX/status/1495714813447712773
48,2022-02-21 10:59:34+00:00,1495714812009107459,’Koninklijke jonge honden’ zijn volwassener dan topfavoriet Olympia Haarlem en trakteren stadsgenoot op eerste nederlaag in vier jaar. #erismaareneclubintland https://t.co/FqHV91BuaC,KoninklijkeHFC,https://twitter.com/KoninklijkeHFC/status/1495714812009107459
49,2022-02-21 10:59:34+00:00,1495714810134253570,"‼️Brilliant Stars ETB's beschikbaar‼️
let op: pre order voor 25 feb

- 60 stuks
- worden vrijdag verzonden op release
- zaterdag/maandag geleverd

https://t.co/VXQh5y6BCV",monkeloidtv,https://twitter.com/monkeloidtv/status/1495714810134253570
50,2022-02-21 10:59:34+00:00,1495714808678817794,In 2015 werd de uitbreiding van de raadszaal nog tegengehouden als onderdeel van de verbouwing van het gemeentehuis. De kosten zouden 155000 geweest zijn. Iets met sober en doelmatig... #zeewolde https://t.co/MtnOz0BDCH https://t.co/8sJp1gaRLj,MarcelOosterbos,https://twitter.com/MarcelOosterbos/status/1495714808678817794
51,2022-02-21 10:59:33+00:00,1495714804413177860,Haha met wat bent u klaar PS politieke sukkels Poetin krijgt pijn aan zijn kaken van het lachen,danny_vrancken,https://twitter.com/danny_vrancken/status/1495714804413177860
52,2022-02-21 10:59:32+00:00,1495714803754668033,"De provinciale weg N377 tussen Hasselt en De Lichtmis gaat vanmiddag rond 13.00 uur weer open voor verkeer. Eén rijstrook blijft afgesloten en met verkeerslichten wordt het verkeer langs de afzetting geleid. Zie 👉 https://t.co/cLL4qvzyxm

#hasselt #overijssel #N377",ProvOverijssel,https://twitter.com/ProvOverijssel/status/1495714803754668033
53,2022-02-21 10:59:32+00:00,1495714802387279879,"Rutte denkt dat polarisatie kan stoppen, nu het virus lijkt te verdwijnen https://t.co/HVTUH7IJHj via @NOS Corona Wappies (pro lockdowns BAH), Wappies en iedereen we kunnen weer gewoon normaal doen! :) #wappies #corona #coronamaatregelen",AlwaysNick2,https://twitter.com/AlwaysNick2/status/1495714802387279879
54,2022-02-21 10:59:31+00:00,1495714796880150538,@ernstpietersen Alleen wind mee of ook accu erbij?,OlgadeRoos,https://twitter.com/OlgadeRoos/status/1495714796880150538
55,2022-02-21 10:59:30+00:00,1495714794531430403,Hoogwater aan het #Haringvliet nu. #StormFranklin 🌊 https://t.co/LCOHIuKPdO,MeteoVoorne,https://twitter.com/MeteoVoorne/status/1495714794531430403
56,2022-02-21 10:59:29+00:00,1495714791037583366,PKC wint eerste wedstrijd in Kampioenspoule -  https://t.co/dSIyRgaMGO https://t.co/9KCq2BYuWt,KlaroenNL,https://twitter.com/KlaroenNL/status/1495714791037583366
57,2022-02-21 10:59:29+00:00,1495714789053681669,Hoop voor ouderensoos De Driehoek in binnenstad van Almelo https://t.co/0JW3C5QCVD,TCTAlmelo,https://twitter.com/TCTAlmelo/status/1495714789053681669
58,2022-02-21 10:59:28+00:00,1495714786973302786,@Fotograafje21 Ze hadden Rob Jetten met € 100 miljard op de toeslagenaffaire moeten zetten.,ed48nl,https://twitter.com/ed48nl/status/1495714786973302786
59,2022-02-21 10:59:28+00:00,1495714786465783809,"Heeft u onze huiskamer al gezien? Welkom, welkom, welkom! 
https://t.co/rO2Yjnhvfl #gemeenteraad #gemeenteraadsverkiezingen2022 #gemeenteraadsverkiezingen #lelystad #raadslid #raadsleden #gemeenteraad",raadvanlelystad,https://twitter.com/raadvanlelystad/status/1495714786465783809
60,2022-02-21 10:59:28+00:00,1495714785123516423,JAKZJAKZJSJSJAJSJAJJDKSNS,glupw_,https://twitter.com/glupw_/status/1495714785123516423
61,2022-02-21 10:59:28+00:00,1495714784863559692,Met mijn leerlingen (eindelijk) weer eens in een museum! @maritiemmuseum #dealenmetdrugs https://t.co/CayOVGS4G9,JimmySmet,https://twitter.com/JimmySmet/status/1495714784863559692
62,2022-02-21 10:59:27+00:00,1495714782544072710,"21-02-22 11:59:25 0754007 FZ VBR 2 (2502)-(LEU MAP 1 (P18)) [Onderofficier] &gt; Persoon opgesloten in lift BNS """,cpa_breda,https://twitter.com/cpa_breda/status/1495714782544072710
63,2022-02-21 10:59:27+00:00,1495714782426857476,@brngsekkk laper ga boong,sxznoo,https://twitter.com/sxznoo/status/1495714782426857476
64,2022-02-21 10:59:27+00:00,1495714780581093376,"21-02-22 11:59:25 0754005 FZ VBR 2 (2502)-(LEU CW 1 OVD (C19)) [Chauffeur commandowagen LVO] &gt; Persoon opgesloten in lift BNS """,cpa_breda,https://twitter.com/cpa_breda/status/1495714780581093376
65,2022-02-21 10:59:27+00:00,1495714780325322758,"WHHAKAHAIJSJSJS HIS OUTFIT WHA
#MEWMADEforU @MSuppasit",mewnielove,https://twitter.com/mewnielove/status/1495714780325322758
66,2022-02-21 10:59:27+00:00,1495714780027527169,"“We waren dronken. Ik heb niet veel herinneringen, alleen dat mijn penis opeens in haar zat.” 🙈🙈🙈",Soul7Food,https://twitter.com/Soul7Food/status/1495714780027527169
67,2022-02-21 10:59:26+00:00,1495714776261013506,Waarom denkt extreem links altijd meteen aan toepassen van geweld? https://t.co/95NUpLusHc,Barry_deH,https://twitter.com/Barry_deH/status/1495714776261013506
68,2022-02-21 10:59:25+00:00,1495714773450776578,"21-02-22 11:59:23 0754052 FZ VBR 2 (2502)-(LEU CW 1 OVD (C19)) [Officier van wacht] &gt; Persoon opgesloten in lift BNS """,cpa_breda,https://twitter.com/cpa_breda/status/1495714773450776578
69,2022-02-21 10:59:25+00:00,1495714770581917699,"[Hete aanbieding] [Nu: €88,19] BK Bourgogne pannenset 4-delig nu 50% korting @ BK https://t.co/F2yHyu8h4v https://t.co/GY9J5zVWI9",PepperNederland,https://twitter.com/PepperNederland/status/1495714770581917699
70,2022-02-21 10:59:24+00:00,1495714767159316483,Ik dacht ook al.,ronald1michel,https://twitter.com/ronald1michel/status/1495714767159316483
71,2022-02-21 10:59:23+00:00,1495714765288747011,Mmm... daar lijkt het wel op. Terwijl wij wappies nog even strijdbaar zijn.,BenserWalt,https://twitter.com/BenserWalt/status/1495714765288747011
72,2022-02-21 10:59:23+00:00,1495714764026257413,"De tarweprijzen gaan flink op en neer. Vorige week waren het vooral winstnemingen die de koers omlaag drukten. Op het lagere niveau stappen speculanten weer in en beginnen de prijzen weer aan te trekken, laat @Agrifirm weten. #tarweprijs https://t.co/w6zNyusgmO",nieuweoogstnl,https://twitter.com/nieuweoogstnl/status/1495714764026257413
73,2022-02-21 10:59:22+00:00,1495714761073467394,"Deze blik en gezichtsuitdrukkingen van een onverkozene vertellen niets hoopgevend. Een geniepige strategie om deze te laten uitvoeren door niet verkozenen.
Digitaal EU-COVID-certificaat wordt in de hele EU ingevoerd per 1 juli https://t.co/oCkO6qilQD via @DissidentNL",MMaeseneire,https://twitter.com/MMaeseneire/status/1495714761073467394
74,2022-02-21 10:59:22+00:00,1495714761048305669,@Hefbundy zet me aan tafel joh volgende aflevering je gaat geen spijt krijgen pa !,snipes34,https://twitter.com/snipes34/status/1495714761048305669
75,2022-02-21 10:59:22+00:00,1495714760750419972,@Uruvielina Ik kan mij herinneren dat Red Guardian het door de Soviet Armed Forces gemaakte serum kreeg. Dus het js hun gelukt het na te maken.,CoelacAnthony,https://twitter.com/CoelacAnthony/status/1495714760750419972
76,2022-02-21 10:59:22+00:00,1495714759357915143,"Kun je jezelf ook verliezen in herhalende gedachten, herkennen van patronen en cijfers en al die intuïtieve ingevingen waar je wel of niet gehoor aan MOET  geven?
Dat is ook een HSP ding......
Leer er mee om te gaan.🌟 https://t.co/syiGD63zc1",jovannavriend,https://twitter.com/jovannavriend/status/1495714759357915143
77,2022-02-21 10:59:20+00:00,1495714753276268545,Ik ben niet met talking stage als je niet komt meeten real life. je bent ook mens niet meer dan andere. Wat doe je moeilijk om te uiteten of wat te drinken. Maar je hebt zo een dikke bek op internet NAS NAS sws toxic met bordeline,cookie010_,https://twitter.com/cookie010_/status/1495714753276268545
78,2022-02-21 10:59:19+00:00,1495714747102244876,"Wat ik haat aan geen student meer zijn, is dat fouten maken nu echte consequenties heeft. En niet alleen voor jezelf.",anderralph,https://twitter.com/anderralph/status/1495714747102244876
79,2022-02-21 10:59:18+00:00,1495714744933797889,"Maag-darm specialist Daan Koning nam de KCA-kids mee in zijn werkzaamheden: hoe je met speciale apparatuur in de darmen van mensen kunt kijken (en ook kunt opereren!), hoe je ziekenhuiskleding moet dragen en hoe je de waarden van je bloed kunt meten.  Een super interessante les! https://t.co/oDjWM2Sh0P",KidsCollegeApel,https://twitter.com/KidsCollegeApel/status/1495714744933797889
80,2022-02-21 10:59:18+00:00,1495714743201456133,Hidden bangers 🔥🔥🔥 https://t.co/5jS2cZDQhm,raheelinho,https://twitter.com/raheelinho/status/1495714743201456133
81,2022-02-21 10:59:18+00:00,1495714743167946753,@rozamoende @noorisgoor gebaseerde tweets bedoel je,lipless13,https://twitter.com/lipless13/status/1495714743167946753
82,2022-02-21 10:59:18+00:00,1495714741876056070,Is geen rente op spaargeld Gekte . Negatieve rente is Totale Gekte !,kswart1,https://twitter.com/kswart1/status/1495714741876056070
83,2022-02-21 10:59:17+00:00,1495714739774754818,"De gemiddelde thuiswerkvergoeding bedraagt 67 euro. Bij @BelgiumDefence is dat 1 euro per werkdag… Volgens mij is hier toch nog ruimte voor verbetering, niet!? https://t.co/0BxgOjQosv",MiepMiep04120,https://twitter.com/MiepMiep04120/status/1495714739774754818
84,2022-02-21 10:59:17+00:00,1495714739728662544,"@Aut_ItIsI @F82Danny @Follymans Hier mooi uitgelegd:

https://t.co/UAhw1dw6ln",Orakela,https://twitter.com/Orakela/status/1495714739728662544
85,2022-02-21 10:59:17+00:00,1495714739447640068,"Ben JIJ al op zoek naar je zielenfamilie?
Ben JIJ al op zoek naar mensen waar je blij van word..
Mensen waar je geestelijk van groeit?

Het kaf word inmiddels van het koren gescheiden 

#eindtijd 
#zielenfamilie 
#zielsmissie_volgen 
#leven_in_het_Nu
#bewust_zijn 
#openbaring",ZJitzzz,https://twitter.com/ZJitzzz/status/1495714739447640068
86,2022-02-21 10:59:16+00:00,1495714736188665857,Politie is totale integriteit kwijt.,LFieret,https://twitter.com/LFieret/status/1495714736188665857
87,2022-02-21 10:59:16+00:00,1495714735530164224,Als je denkt dat het een goed idee is om interval blokjes mee te doen met deze toppers 😵‍💫🤢 BEDANKT!!!! @talentned #buildingfuturewinners @ridecannondale @bioracer https://t.co/jicr3u4DkC,RoxaneKnetemann,https://twitter.com/RoxaneKnetemann/status/1495714735530164224
88,2022-02-21 10:59:16+00:00,1495714735144472577,"Laatste werkzaamheden als secretaris, binnenkort ALV en dan klaar! #geenverplichtINGenmeer #afbouwen https://t.co/5AQAsrKD97",IngesDepartment,https://twitter.com/IngesDepartment/status/1495714735144472577
89,2022-02-21 10:59:15+00:00,1495714731964915714,En alle boosters die daar al gekocht zijn. Van een nieuwe serie.,watte12,https://twitter.com/watte12/status/1495714731964915714
90,2022-02-21 10:59:14+00:00,1495714728269725700,"Mensen die zich voor je deur parkeren, telefoneren in de wagen en jij kan het gesprek gewoon horen. 

Echt, waai toch weg.",Eva_DP,https://twitter.com/Eva_DP/status/1495714728269725700
91,2022-02-21 10:59:14+00:00,1495714726940393478,"WODIEIXUWJAJNAANANWWAAAAAAJOKEEEEEENNNNNNNN!!!

SB19 onWISHBUS
#SB19xAtinWishComeTrue 
@SB19Official #SB19",hdgz_aesbi,https://twitter.com/hdgz_aesbi/status/1495714726940393478
92,2022-02-21 10:59:14+00:00,1495714725715488773,"“Dat is de democratisering van het proces waar onze partij D66 voor staat. Laten we de positieve energie die in deze wijk aanwezig is benutten.”
@D66Groningen #vrijenverbonden #teamd66 #D66",SanderClaassen,https://twitter.com/SanderClaassen/status/1495714725715488773
93,2022-02-21 10:59:14+00:00,1495714724918427651,6 slot left palli,qeahracha23,https://twitter.com/qeahracha23/status/1495714724918427651
94,2022-02-21 10:59:13+00:00,1495714722116734976,@ricodevos @EelcoBB Dat de maanlanding een hoax is een heel ander koek waar ik ook niet in geloof maar de maan is gewoon rond zoals elk ander lichaam in de ruimte.,PinealPhoto,https://twitter.com/PinealPhoto/status/1495714722116734976
95,2022-02-21 10:59:13+00:00,1495714721160437764,"Er is een nieuwe klacht gemeld over Facebook op https://t.co/s8ifVv0DFc, zie https://t.co/z92WqEU2yS Oplossen? https://t.co/Ls4T06i8Ff",Klacht_NL,https://twitter.com/Klacht_NL/status/1495714721160437764
96,2022-02-21 10:59:13+00:00,1495714720665505801,Moon Garden 😍 https://t.co/cW1S1G4l2x,leesoyoungholic,https://twitter.com/leesoyoungholic/status/1495714720665505801
97,2022-02-21 10:59:12+00:00,1495714720187400192,"@Verwardwezen @Chasalin Voor de goede orde, SP is niet mijn club. De communisten hebben destijds onderdak gevonden bij GroenLinks en juist niet bij de SP. Om die reden verbaasden mij de berichten die destijds over dit onderwerp werden gemeld. Ik kan ook niet zo goed duiden waarom dat zo is 1/2",henkwimmmenhove,https://twitter.com/henkwimmmenhove/status/1495714720187400192
