,Datetime,Tweet Id,Text,Username,Url
0,2022-08-24 10:59:57+00:00,1562394275664510976,"Ze draaiden eerst love myself van rondé bij de kaakchirurg toen ik nog in de wachtkamer zat en toen ik in de stoel ging zitten kwam as it was van harry op
Goeie muziek daar, hielp wel hahah",sunfloweralec,https://twitter.com/sunfloweralec/status/1562394275664510976
1,2022-08-24 10:59:57+00:00,1562394274989309952,🥳🥳Begin van het eind? 🥳🥳👇👇,Midi1423,https://twitter.com/Midi1423/status/1562394274989309952
2,2022-08-24 10:59:57+00:00,1562394273659879427,"13:00:12 Prio 1, Zwemmer in problemen / vermist, CDZ Station CAZ Cadzand - Opstappers boot",knrma,https://twitter.com/knrma/status/1562394273659879427
3,2022-08-24 10:59:57+00:00,1562394273659568131,"13:00:12 Prio 1, Zwemmer in problemen / vermist, CDZ KNRM",knrma,https://twitter.com/knrma/status/1562394273659568131
4,2022-08-24 10:59:57+00:00,1562394273185959938,Is de zomerzwoele trance van rond 2002 terug? Meer van dit! 😍 https://t.co/3fbiokvklM,Scarbir,https://twitter.com/Scarbir/status/1562394273185959938
5,2022-08-24 10:59:57+00:00,1562394272820871168,Ameen,RehanUl49673299,https://twitter.com/RehanUl49673299/status/1562394272820871168
6,2022-08-24 10:59:56+00:00,1562394270186831872,zort,itsderinerdogdu,https://twitter.com/itsderinerdogdu/status/1562394270186831872
7,2022-08-24 10:59:56+00:00,1562394269348147201,CONGRATS ZOE BB 😍😍,neeylou,https://twitter.com/neeylou/status/1562394269348147201
8,2022-08-24 10:59:55+00:00,1562394267162902528,Q1 13163 Jan Tooropstraat 1061 Amsterdam 80478 https://t.co/0AH8YnqGa8,112Amsterdam,https://twitter.com/112Amsterdam/status/1562394267162902528
9,2022-08-24 10:59:55+00:00,1562394266969772032,@Wiekkie70 Dank Wieke!,LovesKoffie,https://twitter.com/LovesKoffie/status/1562394266969772032
10,2022-08-24 10:59:55+00:00,1562394265254531073,Kevin is een lul!,KKevrides,https://twitter.com/KKevrides/status/1562394265254531073
11,2022-08-24 10:59:55+00:00,1562394264813846529,"En zo gaan de dingen…

Politiek schuift door naar belangrijke functies in de zorg…",zorgenzo,https://twitter.com/zorgenzo/status/1562394264813846529
12,2022-08-24 10:59:55+00:00,1562394263836557312,TRES DIAS DIKDUXKSKZJAIJZSN,wllsxhs_fl,https://twitter.com/wllsxhs_fl/status/1562394263836557312
13,2022-08-24 10:59:54+00:00,1562394263656316928,"Deze ook elke dag opnieuw.
@alexanderdecroo @AnneliesVl  @GLBouchez @openvld @MR_officiel @vooruit_nu @PSofficiel @cdenv @lecdh @groen 
@Ecolo @defi_eu @vlbelang @pvdabelgie https://t.co/Gyra5BBqvM",TimReynders,https://twitter.com/TimReynders/status/1562394263656316928
14,2022-08-24 10:59:53+00:00,1562394255670525953,worst vday,arkadex_bot,https://twitter.com/arkadex_bot/status/1562394255670525953
15,2022-08-24 10:59:52+00:00,1562394253547843591,ooo sexy neukkim 😏,bloogguk,https://twitter.com/bloogguk/status/1562394253547843591
16,2022-08-24 10:59:52+00:00,1562394253233364992,@tahajmamin ahhaha kush mr prindt a ?,arif_d_o_o_,https://twitter.com/arif_d_o_o_/status/1562394253233364992
17,2022-08-24 10:59:52+00:00,1562394251828215808,Uitkoopregeling boeren onzeker: mogelijk ongeoorloofde staatssteun https://t.co/r2iowF05yg,De_Stentor,https://twitter.com/De_Stentor/status/1562394251828215808
18,2022-08-24 10:59:51+00:00,1562394249152237568,"@MijnSelma @NUnl Op wijkniveau, van huis tot huis, is vaak helemaal geen piekprobleem, op midden-spanningsnetten wel. 
Isoleren is trouwens in beide gevallen beter. Minder energiegebruik is goed voor het net!",dwarshuis,https://twitter.com/dwarshuis/status/1562394249152237568
19,2022-08-24 10:59:50+00:00,1562394246463774720,Ben ik de enige die een klein defect heeft in zijn thermostaat van #honeywell 0 niet zichtbaar. Nog geen 5 jaar oud! Is het de bedoeling dat je weer € 187 euro gaat uitgeven? Elke 4a5 jaar? #belachelijk niet aanschaffen dus! https://t.co/pJGlQKguLT,simpsomi,https://twitter.com/simpsomi/status/1562394246463774720
20,2022-08-24 10:59:50+00:00,1562394246006689792,"Kabinet valt niet: Peter Heerma (CDA), Jan Paternotte (D66) en Sophie Hermans (VVD) grappen en grollen tijdens debatschorsing https://t.co/ZQingSaCtS",Agnescmv,https://twitter.com/Agnescmv/status/1562394246006689792
21,2022-08-24 10:59:50+00:00,1562394245448830976,Von der Leyen onthult grote Oekraïense vlag op de Grote Markt https://t.co/qlPTOQviAs,BRUZZbe,https://twitter.com/BRUZZbe/status/1562394245448830976
22,2022-08-24 10:59:50+00:00,1562394243586560000,"@hansbeikes @NOS Gaat om ongeoorloofde 'staatssteun', aangezien de EU (nog) geen 'staat' is dus geoorloofd",RookieCrptRoost,https://twitter.com/RookieCrptRoost/status/1562394243586560000
23,2022-08-24 10:59:49+00:00,1562394240394547201,"ga papa nooit meer nieuwe shampoo laten kopen want hij heeft shampoo gekocht voor krullen,, niemand in dit huis heeft krullen behalve m’n 12 jarige broertje die hier om de week is 😭",smilingjhobi,https://twitter.com/smilingjhobi/status/1562394240394547201
24,2022-08-24 10:59:49+00:00,1562394239132221441,"@chantalcoolsma @GLS_NL PostNL laat al 4 dagen weten ""mogen"" tussen 12:00 en 14:30 langs te komen. Maar het pakket zit waarschijnlijk vast bij inklaringen. En ik mag 15 september contact opnemen mocht het niet binnen zijn voor teruggaaf BTW / inklaringskosten... bezorgdiensten zijn een drama.",WvanWaas,https://twitter.com/WvanWaas/status/1562394239132221441
25,2022-08-24 10:59:48+00:00,1562394234539462656,"@herbeeertt @telegraaf Dan heb jij niet opgelet, het ging namelijk ook over de koopkracht en daar heeft de minster van financien zeker wel wat over te zeggen.",erikabrink,https://twitter.com/erikabrink/status/1562394234539462656
26,2022-08-24 10:59:47+00:00,1562394233692119041,'Overheden hebben te weinig invloed in de energie markt.' is een soort uitspraak dat alleen maar mensen die niet in de energiemarkt zitten kunnen zeggen.,LodeCossaer,https://twitter.com/LodeCossaer/status/1562394233692119041
27,2022-08-24 10:59:47+00:00,1562394232110960640,"Er viel me net iets op: 

15 juni: TB wil armoede tegengaan.
7 juli: FvD stemt TEGEN minimale stagevergoeding in cao.

Zelfs de fokking VVD stemde vóór. https://t.co/IgXNGh5ZEP",KuunWiir,https://twitter.com/KuunWiir/status/1562394232110960640
28,2022-08-24 10:59:47+00:00,1562394231095939072,Burgemeester Wienen van Haarlem in debat tegen mij:'De economie is booming.' Ik was sprakeloos...,LeroyAlberts,https://twitter.com/LeroyAlberts/status/1562394231095939072
29,2022-08-24 10:59:46+00:00,1562394229158166528,Respect voor deze man die net als Ronald Reagan vanuit acteur zijnde uitgegroeid is tot een een groot man en een echte leider kunnen er veel nog een hoop vam leren !!,KoendersJh,https://twitter.com/KoendersJh/status/1562394229158166528
30,2022-08-24 10:59:45+00:00,1562394224011710464,"Boas op het martinikerkhof weer super stoer aan het doen lol 
Gedragen zich een beetje alsof ze militairen zijn, gewoon die ""I'm the boss here"" uitstraling

F dat lol",SheepleTalks,https://twitter.com/SheepleTalks/status/1562394224011710464
31,2022-08-24 10:59:44+00:00,1562394220345933824,"Gek, het hele land zit op slot want oei oei oei misschien wel schadelijk, maar rond Zandvoort mag ALLES. Hoe zou dat toch komen? 🤔🤣🤣

Natuurorganisaties verliezen zaak over fanzone circuit Zandvoort https://t.co/3GNp2ZWZ7G via @telegraaf",DolfijntjeT,https://twitter.com/DolfijntjeT/status/1562394220345933824
32,2022-08-24 10:59:43+00:00,1562394217246330880,Mee eens,jorgsengers,https://twitter.com/jorgsengers/status/1562394217246330880
33,2022-08-24 10:59:43+00:00,1562394216604606465,"Zaterdag 10 September
#Groningen #DutchUprising https://t.co/RlQqtZ27FG",NldTmv,https://twitter.com/NldTmv/status/1562394216604606465
34,2022-08-24 10:59:43+00:00,1562394215589580800,waarom is het weer zo kk warm is klaar nu,muchtoomean,https://twitter.com/muchtoomean/status/1562394215589580800
35,2022-08-24 10:59:43+00:00,1562394215543603201,24-08-22 12:59:39 0222014 ZLAP2AP BevelvoerderTI bevrijding voertuig9240 ZELE (ZELE),cpa_breda_OVL,https://twitter.com/cpa_breda_OVL/status/1562394215543603201
36,2022-08-24 10:59:43+00:00,1562394214952042497,"@Joe18122000 Ben vandaag in een te goede bui, sick chest",Explosivv2,https://twitter.com/Explosivv2/status/1562394214952042497
37,2022-08-24 10:59:43+00:00,1562394213563744256,Dus Rutte gaf geen antwoord op de vraag of mensen worden afgesloten van het gas wanneer ze het niet kunnen betalen? Wat in en in slecht ben je dan! De gasprijzen rijzen de pan uit. Hoe moet je dat betalen dan? Niet meer eten? Kotsmisselijk 🤮🤮,coravanvliet2,https://twitter.com/coravanvliet2/status/1562394213563744256
38,2022-08-24 10:59:42+00:00,1562394210656849920,"Amper drie weken voor de parlementsverkiezingen zijn vijf van de grootste Zweedse politieke partijen in verlegenheid gebracht. Ze bleken bereid de wet te schenden om donaties binnen te slepen.
https://t.co/ymwhIS7aJt",trouw,https://twitter.com/trouw/status/1562394210656849920
39,2022-08-24 10:59:41+00:00,1562394207284854784,"Woensdag 8 juni jl. sprak #ConceptNederland dankzij Nazima Bagkari over de #arbeidsongeschikten die voorgoed vastzitten in de #bijstand. Je kunt deze groep mensen niet blijven belasten. Je moet ze een #VeiligVangnet geven, gelijke rechten en plichten volgens #VNVerdragHandicap!",EDalhuysen,https://twitter.com/EDalhuysen/status/1562394207284854784
40,2022-08-24 10:59:41+00:00,1562394207209267200,ik moest zelfs geen halfuur wachten 🫶 danne king,moshuyati,https://twitter.com/moshuyati/status/1562394207209267200
41,2022-08-24 10:59:40+00:00,1562394204852039680,24-08-22 12:59:36 0222002 ZLAP1AP BevelvoerderTI bevrijding voertuig9240 ZELE (ZELE),cpa_breda_OVL,https://twitter.com/cpa_breda_OVL/status/1562394204852039680
42,2022-08-24 10:59:40+00:00,1562394203698724864,"Zijn er mensen die ervaring hebben met een #fairphone? Hoe bevalt dat? Kun je er echt langer mee doen dan andere telefoons of zijn ze dan toch na een paar jaar niet meer compatible met nieuwe software, of is het geheugen te vol?
#dtv",g_h21,https://twitter.com/g_h21/status/1562394203698724864
43,2022-08-24 10:59:39+00:00,1562394200229953536,"@supgirl1984 Het belangrijkste is om eerst naar onszelf te kijken wat kan ik beter doen. En doe dingen beter, op gebied van milieu en mens. 

Maak contact met mensen die ""volgens sommigen "" anders zijn en vraag eens waarom. In plaats van boe roepen of uitkotsen.",GertVeurink,https://twitter.com/GertVeurink/status/1562394200229953536
44,2022-08-24 10:59:39+00:00,1562394198577451008,"Nieuws: Open brief van Bertien Minco, directeur van Herinneringscentrum Kamp Westerbork aan Eveline Aendekerk https://t.co/zaaKpN1n9D",MarianneCramer,https://twitter.com/MarianneCramer/status/1562394198577451008
45,2022-08-24 10:59:38+00:00,1562394192860561408,De landbouwminister van de Duitse deelstaat Nedersaksen Barbara Otte-Kinast wil de beperkingen als gevolg van een 'puntuitbraak' van Afrikaanse varkenspest in haar deelstaat verkorten. #Afrikaansevarkenspest https://t.co/NGbRMogRUb,VakbladVarkens,https://twitter.com/VakbladVarkens/status/1562394192860561408
46,2022-08-24 10:59:37+00:00,1562394192256634880,Die wordt vanaf dan vogelvrij verklaard.,columbo37763983,https://twitter.com/columbo37763983/status/1562394192256634880
47,2022-08-24 10:59:36+00:00,1562394186317430784,@Iswiezeis Dan ben ik heel erg benieuwd naar deze pyjama😉,Sonjade2e,https://twitter.com/Sonjade2e/status/1562394186317430784
48,2022-08-24 10:59:35+00:00,1562394182819643393,"Schreuder zorgde al eerder voor Ziyech-transfer: ""Bewuste keuze"" https://t.co/mOnyqmkxTb https://t.co/Hq6Rsq7yMN",Ajax_fansnl,https://twitter.com/Ajax_fansnl/status/1562394182819643393
49,2022-08-24 10:59:35+00:00,1562394180932042752,Proeflessie aangevraagd 👍🏻,JacqueIiina,https://twitter.com/JacqueIiina/status/1562394180932042752
50,2022-08-24 10:59:33+00:00,1562394175533989889,@Wenslauw Moeten we af en toe even kamercontrole doen? :-D,Woordlab,https://twitter.com/Woordlab/status/1562394175533989889
51,2022-08-24 10:59:33+00:00,1562394174825037824,Ameen,juniormedsesay,https://twitter.com/juniormedsesay/status/1562394174825037824
52,2022-08-24 10:59:33+00:00,1562394174162620416,Elke dag #retweeten wij de berichten met #daghap. Enkel en alleen van de #Restaurants &amp; #Café's die zich hebben aangesloten bij ons!,DagHappen,https://twitter.com/DagHappen/status/1562394174162620416
53,2022-08-24 10:59:33+00:00,1562394172975357952,Ik heb buscombi kaartje te koop voor #gaespa ivm een corona besmetting. Bij interesse stuur dan een privé bericht. #SpartaRotterdam,meneerfred1985,https://twitter.com/meneerfred1985/status/1562394172975357952
54,2022-08-24 10:59:32+00:00,1562394171230535680,"Redactie Jinek: nooit bedoeling om Micky te overvallen met beelden aanslag 

Hou toch op
Je bent over datum en iedere rel levert kijkers op
Natuurlijk ging het volgens planning

https://t.co/7soMwEHtWX via @Telegraaf",Bonkie52526205,https://twitter.com/Bonkie52526205/status/1562394171230535680
55,2022-08-24 10:59:31+00:00,1562394166998474752,"@d66 @vvd @christenunie @cdavandaag, de partijen die absoluut niets geven om de bevolking. Het dictatuurkabinet #Rutte4 van NL onder leiding van crimineel @MinPres.",oakie65,https://twitter.com/oakie65/status/1562394166998474752
56,2022-08-24 10:59:31+00:00,1562394164909817857,Ik snap et ni meer,Laurapieters__,https://twitter.com/Laurapieters__/status/1562394164909817857
57,2022-08-24 10:59:31+00:00,1562394164712570880,@Barilloche3 Dan stuurt u uw kind toch naar een openbare school? Ik zie het probleem niet.,deniztezcannl,https://twitter.com/deniztezcannl/status/1562394164712570880
58,2022-08-24 10:59:31+00:00,1562394163353731072,"@Ticketmaster_NL Hi, gisteren kaarten voor Coldplay besteld, geld is afgeschreven maar de kaarten zijn nog niet zichtbaar, bellen lukt niet vanaf 12.00 uur is de wachtrij al vol",ClaudiaSmit17,https://twitter.com/ClaudiaSmit17/status/1562394163353731072
59,2022-08-24 10:59:30+00:00,1562394160828600320,"Bekijk nu mijn live-activiteit “Gedeelde LiveTrack”!
 https://t.co/Fp1hRuOFm6",Panoias,https://twitter.com/Panoias/status/1562394160828600320
60,2022-08-24 10:59:29+00:00,1562394156361736192,"Ik twijfelde over #zonnepanelen i.v.m lagere energie rekening.
Nu niet meer, blij dat ik die milieu verkwanselende dingen niet heb.",Istinkso,https://twitter.com/Istinkso/status/1562394156361736192
61,2022-08-24 10:59:28+00:00,1562394152977199104,Hihihii gemess,JjenaSuh,https://twitter.com/JjenaSuh/status/1562394152977199104
62,2022-08-24 10:59:28+00:00,1562394152427524096,#Aalscholvers? #Overlast voor vissers? Onzin.,Aasje,https://twitter.com/Aasje/status/1562394152427524096
63,2022-08-24 10:59:28+00:00,1562394151156682752,Fucm'fucj gig uhuyvv,DrpepperIluv,https://twitter.com/DrpepperIluv/status/1562394151156682752
64,2022-08-24 10:59:28+00:00,1562394150552600576,Thogdens let himself go,AVFC_Aston,https://twitter.com/AVFC_Aston/status/1562394150552600576
65,2022-08-24 10:59:27+00:00,1562394150154141696,"@MaritVanOene @overlistener Ja, dat sprookje heerst ook onder mensen uit het vak. Maar ik geloof er nog steeds niks van. Ook niet bij vloerverwarming. Thermostaat op 15 of 17 als er niemand is, is gewoon verspilling.",rudharcom,https://twitter.com/rudharcom/status/1562394150154141696
66,2022-08-24 10:59:27+00:00,1562394149856362497,"@supgirl1984 Iedereen staat met zijn/haar rug tegen de muur. Bij elke prikkeling blaffen ze van zich af zonder naar de argumenten te luisteren. 
Het is eenrichtingsverkeer. Mensen zijn het discussiëren verleerd, helaas.",Sewida3,https://twitter.com/Sewida3/status/1562394149856362497
67,2022-08-24 10:59:27+00:00,1562394147172093952,Zojuist dit actuele en confronterende boek uitgelezen. Dit boek verdient ongetwijfeld verdere aandacht i.h.b. van beleidsmakers én een vertaling in het Nederlands! #theprecariat #hetprecariaat #guystanding https://t.co/VGJZR9gP9s,is3vinc,https://twitter.com/is3vinc/status/1562394147172093952
68,2022-08-24 10:59:26+00:00,1562394143438938112,"Baat dil par lag rahi ho 
par has ke baat taal dena,
is a different level of ""Self control"".",log_kyasochenge,https://twitter.com/log_kyasochenge/status/1562394143438938112
69,2022-08-24 10:59:26+00:00,1562394142898012160,Eindelijk zondag #SPA #GrandPrix met @VerstappenCOM,VdRaad,https://twitter.com/VdRaad/status/1562394142898012160
70,2022-08-24 10:59:25+00:00,1562394141946179584,"#E34 (A21) Eindhoven (Nl) richting Turnhout , ter hoogte van Oud Turnhout Obstakel op de weg, Een badkuip op de uitrit, 24-08-2022 12:56",t_mobilis_nl,https://twitter.com/t_mobilis_nl/status/1562394141946179584
71,2022-08-24 10:59:25+00:00,1562394139274186752,"Ik vind het best, lekker #warm. Heet hoeft voor mij niet, maar vroeger noemden we dit een mooie zomer. En voor wie snakt naar regen, over een paar weken heb je dat weer iedere dag. Driekwart jaar lang. https://t.co/FtcOAd0rIk",Ruud_Paulusse,https://twitter.com/Ruud_Paulusse/status/1562394139274186752
72,2022-08-24 10:59:25+00:00,1562394138204569600,kwil iemand die me elke dag volspamt met snaps en gwn bullshit verteld,davinaliciouss,https://twitter.com/davinaliciouss/status/1562394138204569600
73,2022-08-24 10:59:24+00:00,1562394136946393088,"Bij de ondergaande zon zongen we met ons rockkoor bij De Kaaij onder de brug van Nijmegen. De setting een sprookje, de sfeer magisch. Dat je zo’n geluksgolf over je heen krijgt waardoor je even niet kunt zingen ✨ https://t.co/8Xlz9ZqXBl",MarlousLuv,https://twitter.com/MarlousLuv/status/1562394136946393088
74,2022-08-24 10:59:24+00:00,1562394134723399680,"Wat aan de leiding komt wereldwijd als er idioten vervangen worden is alleen maar nog veel gekker.
We zullen zelf moeten opruimen!

NAVO-WEF-SLET-Premier van Finland verandert de presidentiële ambtswoning in een lesbische hoerentent https://t.co/lrLyGq9szE via @theoldreader",Ton_hBC,https://twitter.com/Ton_hBC/status/1562394134723399680
75,2022-08-24 10:59:24+00:00,1562394134194814976,Ik ram hem nog eens lekker in je hol,wil_gerritsen,https://twitter.com/wil_gerritsen/status/1562394134194814976
76,2022-08-24 10:59:23+00:00,1562394132223516672,Het was trouwens weer zooo fijn in Flevoland! https://t.co/n3BBcnPoA1,OscarKocken,https://twitter.com/OscarKocken/status/1562394132223516672
77,2022-08-24 10:59:23+00:00,1562394130545770496,"Industriële zalmkwekers in Tasmanië gebruiken dodelijke onderwater-explosieven met vreselijke gevolgen: ze verblinden, verwonden en doden beschermde pelsrobben. @huonaquaculture @TassalSalmon and Petuna, stop met het gebruiken van dodelijke seal crackers! https://t.co/eAAt7HOfpq",Hey_Roi,https://twitter.com/Hey_Roi/status/1562394130545770496
78,2022-08-24 10:59:23+00:00,1562394130310787072,⁦@christenunie⁩ ⁦@gertjansegers⁩ ⁦@mirjambikker⁩ Leg eens uit???? https://t.co/L28FZtOtEI,MichelleStam1,https://twitter.com/MichelleStam1/status/1562394130310787072
79,2022-08-24 10:59:23+00:00,1562394129539420160,Zijn er mensen met een 🇪🇺 in hun bio die hier een positieve draai aan kunnen geven? Heb even jullie positivisme nodig 💪😘👍 https://t.co/NX9RCV7Dez,AccountVanLamp,https://twitter.com/AccountVanLamp/status/1562394129539420160
80,2022-08-24 10:59:22+00:00,1562394128532529152,Ombudsman NPO krijgt nieuwe klachten over Ongehoord Nederland https://t.co/DZ134FLPlN via @Telegraaf kijken deze klagers alleen maar om te klagen? Er zijn zoveel programma’s waar ik mij aan erger. En daar kijken we gewoonweg niet naar. Dit lijkt meer op een georganiseerde actie.,ctw051249,https://twitter.com/ctw051249/status/1562394128532529152
81,2022-08-24 10:59:21+00:00,1562394122497019904,Verdachte opzettelijk in rijden op vol terras in #Renesse is 51-jarige man uit #Hellevoetsluis: https://t.co/6JulZeZnIo,112Schouwen,https://twitter.com/112Schouwen/status/1562394122497019904
82,2022-08-24 10:59:20+00:00,1562394118617276416,"Allée, @DerFrvde, hoe werd dat in uwen tijd gedaan zonder veldverwarming?
Leer die gasten eens wat bij.

https://t.co/vVz0oO4fTh",stijncoopman,https://twitter.com/stijncoopman/status/1562394118617276416
83,2022-08-24 10:59:20+00:00,1562394117719597057,vraagje,Heldinne,https://twitter.com/Heldinne/status/1562394117719597057
84,2022-08-24 10:59:20+00:00,1562394117312692224,"De kaartverkoop voor Willem II - ADO Den Haag is van start.

Meer info ⤵️",ADODenHaag,https://twitter.com/ADODenHaag/status/1562394117312692224
85,2022-08-24 10:59:19+00:00,1562394116868145152,Cramer ziet die tweede bearmarket golf niet komen! 👍🤫,JDB_trading,https://twitter.com/JDB_trading/status/1562394116868145152
86,2022-08-24 10:59:19+00:00,1562394115786121216,"🔸⚪️🔴Jonker hoofdtrainer van de Oranjeleeuwinnen!⚪️🔴🔸

Onze recente Special-guest Andries Jonker heeft een hele toffe nieuwe uitdaging, gefeliciteerd Andries! Beluister nu beide afleveringen hieronder. 

Deel 1 ➡️ https://t.co/V95QNSG5bb
Deel 2 ➡️ https://t.co/hMaIw8n9G9 https://t.co/JwIPeDFRa6",ArsenlPodcast,https://twitter.com/ArsenlPodcast/status/1562394115786121216
87,2022-08-24 10:59:19+00:00,1562394115148505088,@ebrss4 no man dit laat me fk hard cringen,tsemijuleve,https://twitter.com/tsemijuleve/status/1562394115148505088
88,2022-08-24 10:59:19+00:00,1562394114712297472,Wéér is de VVD de partij met de meeste schandalen https://t.co/0vMR6waR1l,stan1leytank,https://twitter.com/stan1leytank/status/1562394114712297472
89,2022-08-24 10:59:19+00:00,1562394113667899392,Ik heb u in een vorige tweet uitgelegd dat ze dat juist niet doen. Menselijke waardigheid staat hoog in het vaandel in Israel. Zo komen er veel Palestijnen voor medische zorg naar Israel. Andersom probeert Hamas zoveel mogelijk Joden te vermoorden! Wat is nu uw punt?,knipoog50,https://twitter.com/knipoog50/status/1562394113667899392
90,2022-08-24 10:59:19+00:00,1562394113286324224,"Ik ben hier stil van 
🙌 Super veel respect!",MollyBr19895426,https://twitter.com/MollyBr19895426/status/1562394113286324224
91,2022-08-24 10:59:18+00:00,1562394110916444161,@eenbeetjerebels Glazen huisjes...,Marisya100,https://twitter.com/Marisya100/status/1562394110916444161
92,2022-08-24 10:59:17+00:00,1562394107871371264,Deze bioboer zit óók aan tafel bij Remkes: ‘Je moet blind als een paard zijn als je niet ziet dat we een klimaatprobleem hebben’ https://t.co/40tZFNxQNc,Kneupke4,https://twitter.com/Kneupke4/status/1562394107871371264
93,2022-08-24 10:59:17+00:00,1562394106147618816,Het maandelijkse 'vergeten me in te lezen op kattenimport'-drama. Hierna nog 1x in september en 1x in december 🥴 https://t.co/7ZvHDctFoP,VetteSletten,https://twitter.com/VetteSletten/status/1562394106147618816
94,2022-08-24 10:59:16+00:00,1562394102750015489,LETSGPOOOOORHFIJDIS SEXY NUKIM,agu8td,https://twitter.com/agu8td/status/1562394102750015489
95,2022-08-24 10:59:15+00:00,1562394100086751232,Vooral blijven doen!,HoflandHilde,https://twitter.com/HoflandHilde/status/1562394100086751232
96,2022-08-24 10:59:15+00:00,1562394096572022784,Mannen in Ter Apel staan al ingeschreven bij een huwelijksburo tja er moet geld aan verdient worden . Met welk reisburo zijn ze eigenlijk naar ons toe gekomen en waarom doet men daar geheimzinnig over...ik wil het weten opdat ik dat reisburo kan aanbevelen . Kosteloos reizen tja,HHouwerzijl,https://twitter.com/HHouwerzijl/status/1562394096572022784
97,2022-08-24 10:59:15+00:00,1562394096534228992,"@glorygirlikki Het maakt gewn helemaal geen sense om rijst met een vork te eten, guess i will never understand it",FrenkieYonce,https://twitter.com/FrenkieYonce/status/1562394096534228992
98,2022-08-24 10:59:14+00:00,1562394095766671360,Staakt!,BartHekkema,https://twitter.com/BartHekkema/status/1562394095766671360
99,2022-08-24 10:59:14+00:00,1562394093203890177,"@KaronNL Dag Ron,

Heb je een fijne dag?

Het spijt me dat ik in mijn tweet ruimte liet voor interpretatie. Ik zal de volgende keer beter opletten en me derhalve vollediger uitdrukken.

Vriendelijke groet,

Mark van der Linden",Markv_dLinden,https://twitter.com/Markv_dLinden/status/1562394093203890177
100,2022-08-24 10:59:13+00:00,1562394091186491392,@martinp1986 @lientje1967 Als jouw leven goed is wat je zelf beweert waarom zeik je dan toch zo?,Niekje08,https://twitter.com/Niekje08/status/1562394091186491392
101,2022-08-24 10:59:13+00:00,1562394090553081856,"Ze hebben zich speciaal verkleed, de doerakjes! https://t.co/tVSFxymCB3",Pers_Remus,https://twitter.com/Pers_Remus/status/1562394090553081856
102,2022-08-24 10:59:13+00:00,1562394089135407104,. @ThijmenVAL kan je alweer comp?,Snaaatje,https://twitter.com/Snaaatje/status/1562394089135407104
103,2022-08-24 10:59:13+00:00,1562394088628015104,Zonnepanelen op het dak? Eerst maar eens eten… https://t.co/EZWdBQXb7C,CodeoranjeU,https://twitter.com/CodeoranjeU/status/1562394088628015104
104,2022-08-24 10:59:11+00:00,1562394080516218880,Heb jij thuis een ukkie die (vermoedelijk) hoogbegaafd is of een ontwikkelingsvoorsprong heeft? Meld hem/haar/hen dan aan voor de Slimme Ukkies groep in Utrecht! Deze groep is speciaal voor hoogbegaafde kleuters.  https://t.co/JLwqIo1eAg,BepDock,https://twitter.com/BepDock/status/1562394080516218880
105,2022-08-24 10:59:10+00:00,1562394076795781120,"Als nou eens een melding zou doen dat de jeugdzorg aan kinderhandel doet, gaan ze dat dan ook onderzoeken? https://t.co/2FUArT4l3x",JenniferCligne1,https://twitter.com/JenniferCligne1/status/1562394076795781120
106,2022-08-24 10:59:09+00:00,1562394074614743040,Je gaat het bijna echt geloven? Zouden ze Ralf Dekker FvD geen hand geven omdat dit acteurs zijn en niet de echte.,manyavo,https://twitter.com/manyavo/status/1562394074614743040
107,2022-08-24 10:59:09+00:00,1562394074170023936,In Annen momenteel onbewolkt en 28.1 graden. #Annen,HetWeerInAnnen,https://twitter.com/HetWeerInAnnen/status/1562394074170023936
